pregunta,respuesta
trousers trainers gloves or earrings you would say I am glad to like them I am glad,to like them them like them I am glad you like them now number three thanks but is
nothing special that that means it is usual nothing special at all thanks but,is is nothing nothing special do not say special um
special a lot of people proun special no huh this,is okay special special nothing
special thanks but it is nothing special remember if people give compliments,about a singular noun like coat back blouse necklace like this is we would
use is okay thanks but it is nothing special but if that is uh a blur now,like trousers trainers gloves earrings or things like these ones you can use
thanks but they they are they are nothing special or you can pronounce,quickly they they thanks but they are nothing special wish i wish to have a a
million dollars do you want to have a million dollars i do she wished she had,to met him brush i usually brush my teeth three
times a day brushed he has his shoes brushed,every two weeks
establish my husband is going to establish his own company,soon our english center was established 5 years
ago rush theres no need to rush we have still,got lots of time just remember that i do not like
being rushed for the last one,extinguish the firefighter fighers had to fight 4 hours to extinguish the
blaze the flame was finally extinguished so,remember e d up to sh is pronounced t remember we have
wish brushed,text
hello I am jack hello my name is an nice to meet you it is a pleasure so this is,the house it is really beautiful yes it is
but but it is very difficult to keep clean sorry not a good,start do not worry your accent is very clear where are you
from I am from oxford wow oxford 100 english yes and you are,american is that right yes but my family is from italy bolognia italy is
wonderful my sister is in italy at the moment where she has in rome studying,italian painters she has really happy italians are
so friendly and thats alice she has also part of the family it is,nice to meet you alice so this is jack the new flatmate yes and he is from nice
to meet you jack I am from sydney in australia and you are a capricorn yes,amazing i come from america I am from new york wow the big apple
yes okay um can i put my things in the bedroom let me help,you hey this is nice I am glad you like it it is a mexican
hat you look great and what what is this it is an,african mask is it magic of course but look at
this a bottle of italian wine do you like,wine cheers cheers this wine is very good m yes it is
really good by the way you are very lucky look,it is raining now yes i am lucky thats my photo album there the
pictures of all my friends are in here thats interesting show me,yes so this is mary she has from ireland her mother and father are greek her
parents are from greece yes they are are greek huh they are from,athens and whos that uh thats alice no thats not alice yes it is
after a party a halloween party thats funny and and who are they uh thats,sharon and peter they live in the flat near here they are good friends she has
very pretty,hello my name is jack I am the new flagma it is nice to meet you hello jack I am
peter nash and,sharon okay and this is sharon it is a
pleasure how are you sharon fine thanks good your friends but so guys,theres work in the kitchen for everyone and you are a great cook thank
you jack big,announcement finally i have all the points and i can get that marvelous set
of chinese plates what yes with the cookies help me fill in the form jack,please all right let me see the questions whats your name are you
joking okay okay a n n e and whats your family name um my surname yes right uh,baer b a x t e r and whats your phone number
it is um 0454 uhhuh,78620 97 0454 7882 097 no it is
0454 786,2097 right you have to remember this is your
telephone number too you are right are you married no I am,single what a pretty girl like you is still single stop it jack
please yes for the moment I am single next question please where are,you from um there are a lot of questions it is for your chinese place okay for the
last time I am from england from oxford a x f o r d no o x f,o r d just joking it is okay whats next just two more questions the address is
45 trinity lane flat c whats the post code ec1 4rn ec14,rn and whats your job I am an employee in a publishing company well you are
just the right person for me i have a great love story to write,good morning alice how are you hi and good
morning I am fine and you fine thanks excuse me wheres my watch i,do not know is not it under the magazines no it is not are you sure yes
I am sure it is not under the magazines and and I am late i have an appointment,at 800 maybe it is here on the
table no the watch is not here behind the apples next to the pasta,there it is thanks alice you are welcome and
bye,no it is
late alice what time is it just a moment it is half 7 half 7 my train is at,800 hurry up jack you are late okay okay where are my keys they are
here on the table thanks alice now another,problem where is my sweater maybe it is on the chair no it is not where is
it calm down jack you are wearing it thanks,alice you are a lifesaver hurry up go go go
too much stress i must go back to bed,again okay okay girls what time is the dinner tonight at the restaurant uh it is
at half 8 are you sure i think it is at half 9 okay guys when is it I am certain,it is at 830 sorry it is at 930 okay okay it is tonight right yes
it is tonight but what time is it by the way theres a clock over there it is qu,to 7 so if it is after 600 sharons at home h no she is not she has at work no
usually she comes back home after 6 hi sharon good evening hi guys sharon,please help us what time is the dinner tonight it is quite late it is at half 10
see jack half 10 okay you are right I am wrong,women hello an it is you peter look look this is it look at what my office
here near my bed i see by the way where are the office,supplies the computer supplies are in that cupboard over there the folders
pencils pens etc are here in this cupboard and i also have two chairs,good are these for everyone no they are not do not touch anything please okay so
you say you have all of the office supplies no not really um there is not a,fax machine there are not all the programs i need on my
computer and i guess you have an answering machine is it useful i do not,need an answering machine i answer the telephone
myself okay you are right this office is nice and if you need a fax machine i,have one in my apartment thank you wait a minute something is
missing wheres the coffee machine all officers have a coffee machine I am,afraid there is not one here theres a staff kitchen on the other side of the
house in the kitchen we can have some coffee there good,idea do you want milk with your coffee theres a bottle in the back of the
fridge i prefer it without milk but with some,sugar I am afraid there is not any sugar well thats okay black coffee is
good too do you have any of those great,cookies yes there are some cookies over
here peter speaking what,an audition no not at
all I am free,great bye well finally an audition wonderful
when next monday at the opera theater these cookies are fantastic are there,any more there are some more in the box thank you bye an time for
music hey take your dirty napkin away from my,kitchen yes i always go shopping on saturdays the first thing i do on
saturday is drive to the supermarket,i sometimes go shopping on saturdays but usually i sleep
late I am always so tired on saturdays I am never tired on the weekend,the weekend is a time for fun i paint go jogging go out with some
friends unfortunately i sometimes have to study i sometimes do a little work,at the weekend when I am free i like going swimming going to exhibitions or
to concerts if i have enough money and every,sunday i clean up the entire flat and in the evening i watch
tv i never watch tv it is boring peter and i like going to the,cinema at the weekend yes it is important not to watch
too much tv and an hour a day or so thats,enough come on guys you talk like my grandfather work tv housework on the
weekends life is more i want you to take me to places where young people have fun,great get ready grandpa work is so hard guys i wake up at 630 every day have
breakfast and take the train to work every day i,know i get up at 700 but i have a friend at work who usually gets up at 6 why
thats too early it takes him an hour to drive to,work wow thats a long drive yes but he lives in the
country i think he has lucky every weekend he can go for walks,in the woods not in traffic jams i guess thats pretty nice he lives in the
countryside but works in the city a pretty nice,combination what about you sharon what time do you wake up i usually get up at
about 900 but i live in the city it is easy to,get to work yes but you get home very late often 630 or
7 you know i sometimes have five or six groups of tourists a day you work too,much my dear and you sing too much
peter alice i bet you do not wake up at 600,every day tell us something about your typical day at
university well i sometimes have classes in the morning,but i usually have classes in the afternoon on mondays i always attend
lectures in the morning and where do you study i usually study in the library but,i sometimes study at home too when i do not have classes in the morning my
friend david also studies at your university do you remember him david,ly yes i occasionally see him in the library and sometimes in the park in the
park doing what he likes studying there he takes,his books finds a nice park bench and reads there not a bad idea you can study
and enjoy nature at the same time yes i like the park too,unfortunately i often need books that are in the library and what about lunch
do you usually make sandwiches and take them with you no,i hate cooking i usually have lunch in the cafeteria with
friends i do just the opposite i usually cook lunch at home i seldom have,a quick lunch at coffee shops okay guys stop with this boring
talk what about fun do any of you do anything besides working and,studying it is friday remember you are right jack I am so happy
it is friday me too it is weekend,time time for shopping may i ask you a question alice
sure ask any question you like I am an open book do you have a,boyfriend well i go out with some boys but thats nothing
serious according to my birth chart i need some,tans but thats not easy now that saturn is in leo i see anyway i think you have
a strange relationship with boys no i like boys very much they are great at,carrying packages you are exceptional thanks jack but now stop
talking about me lets talk about you what do you think of,me no really I am curious what do you do at work
nothing special um you know speed master the,sporting goods factory yeah sure they produce wonderful running shoes what
department do you work in I am a sales manager last month they gave me a,promotion and now i am responsible for southern europe thats why i moved here
wow thats really interesting you must be very good at work what exactly do you,do basically i look for new clients and keep them informed about new product
lines and take care of their requests what kind of requests do they have,they often ask questions about new models and prices what do you do if they
want a discount well basically i do not get mad,i listen to them and then i tell them no well seriously speaking it depends
each client is different if they are important i try to make an agreement,with them hi an hi sharon wheres peter peter is preparing his
audition well tell peter i wish him good luck do you really care girls we are,talking about jobs tell me about your job sharon what do you do at the moment
ah thats an interesting question really why do you say that well you know i have,a degree in archaeology but now I am doing something quite different do you
have a parttime job no unfortunately it is a fulltime job i work for a travel,agency what do you do i give tours around the city i bring
tourists to monuments and museums and other interesting places thats,nice could i have you as a tour guide for one day I am sorry i only work with
groups usually with japanese people well I am a black belt in karate very,funny but it is not enough it is too bad an stop cleaning for a moment sit
down and tell me about your job okay okay okay okay i work in a,publishing company so you work with famous writers not exactly um i do not
work with the writers i just read their proofs and correct them before printing,ah by the way do you know paul taylor he works with you right yes yeah but we
do not work in the same department he works in the advertising department but,we are good friends every weekend we play tennis together i play tennis I am
jealous do you play tennis too do you want to play with us well just joking i,do not play tennis that well only karate i am beautiful do not say i
beautiful i am beautiful i am in short form you can say,um or you can say I am okay so i am I am so so you can say I am beautiful I am
beautiful number two I am busy or you can say i am busy remember in writing we,cannot use short form like this okay we have to use i am beautiful when you when
it comes to speaking you can say i am beautiful or I am beautiful in speaking,people just want to say quickly so they usually use short form I am so I am
beautiful I am busy for speaking but for writing we use i am beautiful and i am,busy okay so remember i with m now number three he is
crazy he is crazy he is we can say he has so you can say,he has crazy he has crazy he has crazy now number four you can say in
short form he has handsome he has handsome or he is handsome remember in writing we,have to write he is crazy he is handsome number seven and number
eight it is sunny so as you can see it go with is,okay it is sunny in short form we can say it
is it is so you can say it is sunny it is sunny number eight it is great it is great,you are happy you are attractive for writing for speaking you are you are happy
you are attractive number 13 and number,14 we are set so we go with r too we are set set that
means unhappy we are set now we are in short,form we can say we we number 15 15 and number
16 they are excited so you can see they goes with are they are they are,excited excited just like happy uh they are they are excited they are in short
form you can wr sorry you can say there there just like over there,they are so i can say they are excited right number 16 they are hungry
they are hungry or i can say they are hungry so in writing we should write,they are excited they are hungry so remember not is usually after b and
before adjective okay and i i goes with m she,he it singular now we use
is and not is not okay or is not or for she he it we can use,not for you with they
for you with day in the plural nouns we can use are and if not we use are not or,a and for youu we they you can use the short form like
this you are you are not we are not or they are not am i young am i young do,you think that I am young am i young okay I am
fun am i fun okay am i fun or am i interesting um okay you have to pay,attention to my intonation okay here i am young okay so the question am
i young am i young so you raise your voice okay at the end of the question,for you no question i am am i young okay am i
fun so how do you answer if i ask you am i young am i fun,how do you answer me if you think so you would say yes you are because i ask you
like am i young am i fun and you have to answer me yes you are you that means me,okay yes you are are you do not think so you say no you are not okay are not say
aren are not yes you are no you are not you are,unhappy when i move into the question are you unhappy are you unhappy
remember to raise your voice at the end of the question are you unhappy are you,unhappy you are sleepy are you sleepy are you sleepy
okay sleepy that means you want to go to sleep,so if i ask you are you unhappy are you sleepy if that is correct you have to
answer yes i am yes i am or you can link them together yes i yes i am or no I am,not no I am not so hope
rope tell uscope,envelope cope grope slope
microscope lope elope okay now i hope to meet him soon,hope do you like to skip rope rope my father wants to buy a telescope
we have telescope could you read the address on,the envelope for me envelope we believe that he will be able
to cope with the problems cope she was groping her way up to the,staircase in the dark groping grope can you see that the
sun is sloping in the west slope may i borrow your,microscope microscope our dogs were ling along
beside my mom l my cousin has eloped with her,text
unit one making a phone call hello good morning is albert there this is al wow,this is bob what are you doing bob I am sleeping what time is it it is 8 am
time to rise and shine 8 am huh no ill be late for work,no no no no no todays saturday you do not have to work today saturday yeah
thats right no work today thats good hey are you free today,huh today is saturday yeah yeah I am free
would you like to do something together today that sounds good what do you want,to do i do not know what do you want to do i do not know either huh
why do not you come to my house and well think of something okay ill be there in,about an hour okay see you later see ya do it to a friend hello who is it
it is me bob hey bob come on in ive been waiting for you hi how are you I am okay,yes I am still a little bit sleepy i have not had my coffee yet hmm
i understand do you want something to drink,do you have any freshsqueezed orange juice
no I am out of orange juice would you like some grape juice grape juice hmm,that would be great okay sorry out of grape juice 
thats too bad have you had breakfast yet no have you,no i have not are you hungry yes i am lets go out and
get something to eat okay that sounds good my aunt has a breakfast shop near,here great lets go there okay lets go unit three reading and introduction hi
al how are you I am fine thank you in here I am doing good,whos your friend this is bob we went to school together bob this is juanita
hi nice to meet you honey time hi nice to meet you too,you have a beautiful smile thank you you are not that handsome but you look
okay wow thanks juanita is my aunt here no she is not she should be in around ten,heres some menus thank you can i get you anything to drink um ill have
coffee please okay would you like sugar and milk i like my coffee black,okay one black coffee ill have freshsqueezed orange juice please we
do not have any orange juice ill be right back for,breakfast recommendation what do you like to eat for breakfast i like a large
breakfast i like a large lunch large lunch makes me sleepy anyway what do you,recommend for breakfast hmm the pancakes are good pancakes
delicious what else um do you like eggs yes i like eggs huh you could have some,scrambled eggs with toast mm or sunnyside up eggs yummy or sunnyside
up right or an omelet omelets i love omelets cheese omelets ham,omelets vegetable omelets mmm mixed fruit mixed fruit with yogurt makes a
good breakfast thats right and fruit has many vitamins too what else what,else you could have a cup of coffee and a blueberry muffin
hmm muffin and a cup of coffee sounds good so do you you know what you,want to get yes i do and thank you for your recommendations
you are welcome so what will you get a hamburger a,hamburger yes and ice cream by ordering food here is your coffee al
and heres your water thank you you guys ready to order what,do you like to have for breakfast i usually like to have an omelet okay that
sounds good ill have a cheese omelet okay one,omelet do you have pancakes yes how many would you like three please and bacon
three pancakes and bacon would you like toast toast hmm toast,sounds good yes three pieces of toast would you like anything else do you have
any fresh fruit yes today we have fruit salad okay fruit salad and thats all,salad how about you bob what would you like to eat
i would like hamburger and ice cream excuse me i would like hamburger and ice,cream please a hamburger and ice cream for breakfast are you crazy
no I am I am hungry okay one hamburger what kind of ice cream do you want what,kind of ice cream do you have see we have chocolate vanilla and strawberry
vanilla smith would not know it okay unit six,please ha that was a good breakfast yes it was
are you full I am very full you ate a lot i was so hungry,i could have eaten a horse good thing we did not go to the racetrack ha ha ha ah
that reminds me what are we doing today lets go see a movie lets pay the bill,first then well go see a movie ok well see a movie
i need that check please ok just a moment would you guys like to pay,together or separate ah my god i forgot my money thats ok
i have enough uh together please ok the total for your breakfast is 1030 mmhmm,my and usually gives me a 50 discount I am sorry i forgot
thatll be 515 heres 7 you can keep the change,really keep the change yes it is a tip for you thank you al yeah thanks al
ill pay you back when we get to an atm do not worry it is just breakfast,ill get lunch are you sure i in a lot ooh
i forgot about that minute 7 our friend bob is not that michelle,michelle who michelle love that we all went to school together here she comes
hi hey michelle hi hi um how can i help you it is me al,we went to school together all right my god how are you I am fine
did you missed you so much wow thank you i thought ive never seen,you again it is some surprise you bet hows life are you married no I am not
married yet so you are single then free and single how about you are you working,yeah i have a shop at the mall really what do you sell well it is a mobile
phone shop so i sell mobile phones and accessories at the mall hey bob and i,are gonna go see a movie at the mall today interesting anyways and then bob
is gonna buy a phone today really well then you can come to my shop whats your,shop called it is called ring me i know that shop where is it it is on the third
floor at the mall okay yeah well I am sorry but i have to go now,i hope to see you later bobby bye you too unit 8
how is your car hey al wheres your car no i took it to the repair shop did,you have an accident no i left it with the mechanic for a tuneup when will it
be ready the mechanic said it will be ready on monday thats such a long time,yeah it is a long time are you planning on going on a trip no i just take it to
the mechanics every 3000 kilometers or so why do you do that,it is very old it needs a lot of care how old is your car
it is a 1975 model ha thats not so old my grandmother was born in 1912 well i,guess compared to your grandmother my car is not that old hey wait a minute how
are we going to get to the movie huh we can walk or go by train up to you are,you crazy walk the shopping mall is much too far
well in that case well go by train route it 9 about the train so bob do you,take the train often yes al almost every day almost every day thats a lot well i
enjoy the train it is very convenient i see and it is the fastest way to travel,across town are there many people on the train during the rush hour well there
are many people in the morning before work and there are many people in the,evening after work what about other times at other times no not so many
people and theres never a traffic jam on the train theres never any traffic,jam thats good it is the fastest way to travel yeah you
know i think it is faster than driving in a car and the train is not very,expensive hey bob look at that sign the university uh uh we are waiting for the
wrong train we are on the wrong platform teacher yes we are on the wrong platform,so now what do we do well we can take it taxi taxis are good yes taxis are good
lets take a taxi and we will not waste our time waiting for the wrong train unit,ten a pair of shoes shoes are lovely can i see them which ones do you like that
black hair looks really cool umm the black ones yeah the black ones they are,quite lovely imported from italy ive been to italy how much are they
these shoes are 80 80 thats so expensive,not so expensive only 40 for one shoe do you have another pair of black shoes
this pair only twenty dollars why are these shoes so much cheaper because,they are made here hmm made here what about the quality the quality is very
good these shoes will last a long time how,fifteen dollars for the pair I am sorry not enough eighteen ill give you
sixteen okay for you special price sixteen dollars would you like a bag no,thats okay thanks anyway ill wear them unit 11 buying a phone hey michelle hi
hi nice to see you again nice to see you too hey al are those new,shoes why yes they are thank you for noticing hmm i got a new pair of shoes
and I am going to get a new mobile phone today well you have come to the right,place have you ever had a mobile phone before no this will be my first phone
do not worry it is easy may i ask why do you want to phone because al will not,let me borrow his anymore thats a good reason why else well everybody else
seems to have a mobile phone maybe i should have one too thats another good,reason so what features would you like a loud ringtone
take it easy and it should vibrate i recommend this one this one great thanks,ill take it great hey how do you like my new phone
unit twelve directions to the toilet is something wrong ah okay do you have a,toilet here no I am so sorry there is no toilet in this shop huh okay uh where
is a toilet well there is a public toilet close to here yeah,where where is it it is really hard to find if you do not know where it is okay
okay go out the door and take a left okay okay,out the door left and then and then walk 15 meters until you see a pet fish shop
okay okay pet shop and then and then youll see a,staircase there go down the stairs up the stairs and then no no no not up the
