pregunta,respuesta
betty where are you,I am right here 
dear betty guess what,you are getting a dog
huh no,you are getting married
what no,okay i cannot guess
look at this,it is a check for 100 it is my prize from a writing contest
you are a winner thats great news thanks betty,what can i do with the money i know i know
you can give it to me you are funny,but i do not think so
maybe you can buy stock i do not know anything about the stock,market dear i do not either
i know i can put the money in a bank account,you can put it in my bank account betty
i can save the money in my account i know I am just kidding,hey i have an idea
lets go to the diner i can buy you lunch,okay goodbye come back soon
we are closed finally,are you glad i really am
is this your wallet,no did a customer forget it
i do not know maybe there is a lot of money inside,maybe the owners name is inside right
is there id or a credit card yes it says,maxwell maxwell
only mom calls me maxwell hey thats my wallet i found it,can i borrow your credit card you cannot use my credit card it has my signature
on it max,you have four credit cards in your wallet do you use them all yes why
are you in debt max is in debt no I am not I am careful,when i charge things maybe i can get a credit card
um a debit card is a better choice for you,why is a debit card better than a credit card using a debit card is like using
cash yes the money comes from your bank,account right away that way you do not spend more money than you have
so i will not go into debt thats right,and you do not pay interest wow
you are helping me manage my money thanks you are still young,this is a great time to learn how to manage your money
i agree the earlier you start the better max,who is the little girl in this picture thats sarah
really thats so sweet i keep all my treasures in my wallet my money my,credit cards and my little sister ah
renee is in the diner with simons brother rich,he has come from the big city to visit his little brother
simon comes in to pick up renee after work,he is surprised to see rich there rich gives simon a big hug
rich has a card and gifts for him you are,giving me more gifts to help me plan my finances
thank you rich you are welcome,one day you will be rich like me
i do not want to be rich so,what is this card it is a cash card
they are popular in the city people say they are the new debit cards,how do you use it you scan the card when you pay for
something then the money is taken from the card,how much money is on this card i put five 500 on this card for you thats
very generous rich,this card is useless in small town we do not have any cash card machines
use it when you visit me in the big city rich,you boys must be hungry let me get you some chocolate cake
you have a great life yes i do,she has better than all the money in the world
yeah,good morning max how are you I am great
you are happy this morning you are right I am very happy this morning,why i love spring
flowers are beautiful the birds are singing,but max spring is not here yet i know but the weather is getting warmer
no more winter hey,lets not work today get simon and sarah
we can have a picnic thats a fun idea but we cannot close a,diner today what about our customers they can join us at the park
no max we are spring cleaning today too remember,yeah
hey we are closing early this saturday lets,have a picnic then great idea the weather is still a little cold for a
picnic but we can still have fun yes i can cook,and clean lets not clean at our picnic no lets clean now
okay i can clean the kitchen,thanks hey
look at our daily special what is it,spring rolls hey max do you have any special plans
for sunday not really,ill probably just relax sunday is my day off you know i know but
sunday is also easter this sunday is easter,no do not you like easter
it is a great holiday i just remembered something,I am cooking the easter breakfast at church
you are cooking on your day off I am sorry max,I am not if max is cooking then breakfast will be
great I am looking forward to it already,I am looking forward to small towns easter activities in the afternoon
the parade the easter egg hunt the easter egg hunt no whats wrong i am,supposed to boil 200 eggs and sarah is supposed to help decorate
them so,she does not know yet this card says
you are one in a million that is really sweet,can i give this to jim whos jim
no one he must be someone,maybe he has even someone special sarah
is jim your special someone max no,jim is just a friend he has not my boyfriend
we are trying to choose a valentines day card for sarahs friend,let me help you okay but
be nice I am always nice,this one is cute lets be friends to the end
that is cute what does it say on the inside,i love you sounds good
what no,i do not love jim i like jim he has my friend
lets keep looking is he your sweetheart this card says,hello sweetheart max
i found one it has a sweet message,what does it say does it say i have a crush on you
no it says,thank you for being my friend thats all thats all
thats not very romantic i know i like it,it is perfect and i can write my own special message
your friend sarah,okay I am done
good jim will appreciate your card read it to us,no it is personal
but I am your brother and you are a good brother thanks,i care about you sarah i want you to know that thank you max you are sweet
i know so,will you read the card now max
you make me smile thats better than making you cry,i might cry you two are so sweet to each other
let me give you a hug uh thanks,max you can give someone a hug too
who your special,someone what are you talking about i do not have a special someone
well you do have a crush on a girl,she always gets the cheese omelette lets not talk about that it is personal
simon betty you are two of my favorite people,hugh you say that to everyone
but you are how are you hugh I am super thank you,how about you I am doing well thanks
great i have something perfect for you,phew you say that all the time what are you selling today
I am selling this i love it,what do you think it is
a heart it is a heart with,arms it is a heart
hug heart hug it is perfect for valentines day,how many do you want sorry hugh
i do not want any what,what about you simon you must want one for renee
I am sorry hugh it is not the perfect gift for her come,on you two let me give you a hug
no no thats okay,maybe max wants one yes
max likes heart hugs you are right,goodbye this is delicious
macaroni and cheese is one of my favorite dishes,i know I am glad because it is easy to make
i cannot believe you cooked this dinner and max even let you use his kitchen,well he knows we celebrated our first valentines day here
the diner is a special place for us simon i fall in love with you more,every day thats what marriage is about i agree
do you remember our first valentines day together of course,do you remember the poem i wrote you you wrote me a poem
you do not remember I am just kidding of course i remember,we were here at the diner and you read the poem on the stage
i was nervous and cute ill never forget that night,is that max in a bunny costume yes this picture was taken a year ago
max and i went to the sweet home orphanage on easter,thats great it was fun
we celebrated easter with the children we gave them easter baskets filled with,candies and cookies they love them it is wonderful that you are going again
this year yes I am excited I am writing letters to,the children i hope theyll be encouraged
you are tired yeah,max and i stayed up late decorating eggs for the easter egg hunt
go to bed early tonight i will,what are you and simon doing for easter we are going to the easter service at
church and then joining the towns activities,fun but be careful during the easter egg
hunt max and i were so tired last night that,we forgot to boil some of the eggs no
max simon told me about your idea i love it,so you guys will go sure we can go on sunday when the diner is closed great
lets leave at 8 oclock thats early,yes i like to get an early start when i go
to the city okay do you want to take two cars or one,lets take one car parking in the city is expensive
okay we can take our car,well pick you up at your place at eight oclock great hey
do you guys like indian food i do not know is it good,it is delicious do you want to try it i know a great restaurant in the city i
can make reservations for us okay that sounds great,I am really looking forward to this weekend me too
betty is sorting mail at the post office she sees an envelope with her name on it,she opens it it is a birthday card
when she opens the cart she hears music betty closes the card,betty opens the card again the music starts again
betty laughs and dances to the music,hi betty nice music
thanks my nephew sent me this musical birthday card,is not it fun it says
leap for joy it is your birthday,happy leap year birthday thats great
so are you excited for your birthday,tomorrow yes I am very excited I am thinking about
getting engaged what,really no
not really but i could get engaged you know,how do you know someone who wants to propose
to you no,but i could propose to someone thats true some women do propose to men
they do now but years ago in great britain and,ireland women could only propose marriage on february 29th
really thats interesting,yes and you know what else
what the man couldnt say no what if he did,then hed have to give the woman a gift sounds like a perfect day for women
yes too bad it only came once every four years,the first one familiar right
this one is pronounced cosmetic cosmetic remember,s here so z okay
cosmetic now cosmetic,you know things like lipstick or foundation concealer or eyeliner
they are used to put on your face to make you to be more,beautiful or attractive you know just like put on a makeup so you have to use
cosmetics cosmetic,cosmetic for number two i think you know this one
you know what i mean is you know the meaning of the word right the popular,styles of hair or clothes or anything but remember do not pronounce a fashion
it is not fashion it is actually a faction,fashion for number three
um this one very familiar,um mosquito
mosquito you know when you are sleeping the mosquitoes,can bite you and makes you hurt okay
so mosquito,remember s here mosquito not more sweet dog
mosquito mosquito or you can even pronounce,mosquito for
number four this one is not that,this one b this b here is silent so we just pronounce
that that you know when you are in depth that,means you owe somebody
you know the money or things like that,that you owe somebody something um
now for number five recommend,this one is not very common or recommend okay it is recommend
recommend recommend that means to,introduce or to tell somebody something is
good or useful or suitable to do or it can also,mean that to advise somebody to do something
recommend recommend for number six,this one please do not pronounce so much even though this one here is
just like watch or catch or teach right but this one is pronounced summer,stomach tell me the reason why ill tell you the
reason why well i do not know stomach,okay so just remember not that much no stomach
okay stomach,um stomach is actually an organ inside your body where the food is contained
stomach for,number seven um
this one is marriage remember,g e here so we have to pronounce marriage not mary h okay marriage
marriage is actually the legal relationship,um between a husband and a wife
marriage for number eight,um you know this one right uh but do not pronounce finance or phoenix
is finance,finance and remember ce here is s
finance finance um,threat second syllable or you can even stress first syllable
finance finance or you can pronounce,finance f here for finance but i usually
pronounce finance finance okay,um finance you know things to do with money
now number nine,we cannot you can pronounce we cannot just like
american sorry we cannot british english and for,american english stress the first syllable weekend but
do not ever pronounce weekend that weekend okay,we cannot or we cannot you know saturday and sunday
um and the last one um,when you see this one you can maybe you can see the similarity between
nature right so you think it is major or just like future or things like that,but actually actually this one is mature
mature mature or you can pronounce as t mature mature okay,or mature anything but usually i would pronounce this one mature mature
c h this one,ture sure
future future,feature feature
nature number three,tual chor
cho actually,actually puncture
puncture virtually,virtually s
t i o n,question question
suggestion suggestion,text
hi renee sarah good can you help me sure,thank you take this red paper
okay what are you doing,I am putting up decorations for lunar new year i do not know anything about lunar
new year how do you celebrate it well on lunar new years eve families get,together then they eat a big meal
what do you eat we eat,chicken fish noodles and dumplings
and parents give red envelopes to their,children red envelopes
the envelopes have money inside cool,we also wear new clothes look at my cheap house it is from my mom
it is really pretty how do you say that word again,pow is a traditional chinese dress
lunar new year sounds interesting i can write about it for the newspaper,great write about the diner too
why this month the diner has a lunar new,year menu we are serving delicious chinese food
all month okay,i can write about the diner but
i want a red envelope first you look great honey,whats the occasion very funny
why are you wearing running shorts tonights lunar new years eve,did you forget no
we are having dinner with my family i do not want to go,well we have to go change your clothes i put your new
clothes in your bag honey,why am i wearing this i feel silly
i like to wear traditional chinese clothes for lunar new year well be a,hit at dinner fine
I am not too excited about seeing my brother,last lunar new year he kept talking about his money
i understand but he has family i know,lets go happy lunar new year
i have a lot of work to do what are you working on,I am writing a column about lunar new year
the date of lunar new year changes every year did you know that yes it follows,the lunar calendar thats right
lunar new year is not just a chinese holiday did you know that many other,asian countries also celebrate new years on the same day
yes max how do you know all this when i cook,foods from different countries i like to learn about the culture too i love
reading about other cultures and foods cool,chinese called their new year chonjiye
and koreans call theirs and vietnamese call it pet but i do not,know much about their traditions do you i know some traditions
do all three holidays have the same traditions,they have similar traditions in all three countries people eat a big
meal with their families cool tradition so what are some of the differences,the food is different koreans enjoy rice cake soup vietnamese
eats sticky rice with meat it is wrapped in leaves i want to try to,make that lets stop talking about food
I am getting hungry ill cook some new years food for us,betty picks up a stuffed rat she gives the rat to sarah because it is
the year of the rat sarah has a gift for betty too,betty is happy but a little confused when she sees the
gift she is not sure what the gift is,thanks uh
what is it it is a chinese paper lantern,it is flat now pick up the top and it opens up
wow where did you get this lantern,in chicagos chinatown i went there with my brother last night
chicago thats far,you must have driven a long time it took us two hours it is okay
we had fun well thats good,we ate a lunar new years eve dinner in chinatown
ive always wanted to go to chinatown you should go,there will be a lunar new year parade on saturday max and i are going
will there be firecrackers yes do you want to go okay,I am sure we can find the best chinese food there
i do not think so i think max cooks the best chinese food,renee listens to them they are talking about maxs daily
special simon does not like it,max is not happy about that he loves his food
renee smiles she walks over to max and simon,whats wrong voice simon cannot appreciate good food
i can appreciate good food i just do not want this food,whats wrong with it simon well
it is strange it is,yes whats so strange about it
simon it is slimy and,it smells a little strange too it smells okay to me simon simon just
try it it tastes really good but simon come on,one bite cannot hurt you and you may really like it
all right hey,this is really good see my food is good
yes it is renee bring me another plate of this,i love it okay honey coming right up
hi sarah how was school great,we are doing presentations on world festivals
my presentation is next week which festival will you talk about,the winter carnival in quebec i can make snow cones for everyone
great idea i can help you,or you can present australia day and talk about the cockroach races i can
help you i found some cockroaches,ben you brought cockroaches into our house
sarah they are safe in the box do not worry,when is this winter carnival in quebec in february
it is the biggest winter carnival in the world,there are many cultural events and they have a night parade
we should go no thanks,ill stay with my new friends maybe you can visit this winter carnival
one day bring lots of warm clothes,now lets enjoy some snow cones
great job you are ready for your presentation,i can see that you did a lot of research yeah
well done so,where are our snow cones ben I am just practicing
fine lets have snow cones at our small town,festival what festival
ben wants to have a small town festival what do you think,i think thats a great idea we do have our own culture here we can
have all kinds of events we can have a fast talking contest,betty would win you are right
i can dance and i can hold cockroach races,what i have my box of cockroaches
right here ben,a restaurant is not the best place for those
and why do you have them they are for the cockroach races,you did say we could have all kinds of events thats true
it would be an interesting way to celebrate small town,how many cockroaches are in there six
do you want to see them no one,two three four five
uhone is missing,theres my beautiful junior reporter hi betty
theres something different about you dear,i know your hair is a different color
no hmm,are you taller
no betty I am the same old me well,you look wonderful thanks betty
so do you have any assignments for me yes i do,i need a writer for my new travel column and are you asking me to write it yes
you are an excellent writer youll do a good job,thanks betty so whats my first column about
for your first column i want you to write about dubai city,dubai city where is that
it is a city in the middle east are there a lot of interesting things in,dubai city there are for example
they have a place to go skiing inside,really fun
yes and right now workers are building the bird to buy,thats the tallest building in the world great
ill be sure to write about that good can you finish this assignment by,thursday ill do my best excellent i cannot wait
to read it betty is in the post office,she picks up a big bag it is very heavy
there are a lot of letters and packages inside the bag simon smiles,he is very excited about his package he wants it now
betty looks inside the bag i am looking,i am looking for a package it is not a big package
okay is your name on the box or is renees,name on the box my name is on there simon way
hmm that is strange i do not see any mail for,you really
are you sure,here it is all right wait
this is not my package it is for simon monroe,sorry
well your package is not in this bag,let me look in the back
heres a magazine for renee but i do not see a package,it is here I am sure sorry
i cannot find it whats in the package,uh
nothing special sorry simon your package is not here,the mail is slow sometimes okay
another mail truck will come this afternoon,come back after four really
thanks betty you are a good mailman,I am not a mailman simon I am a postal worker
right sorry,well you are a great postal worker thanks simon
i enjoy helping people just last week i sorry i have to go now,see you later hey honey
did you go to the post office,was your package there yes i went but my package was not there
yet too bad,do you want to eat lunch here yes
ill go back to the post office if i have time this afternoon,good i have some cards to mail can i give them to you
sure hey,these cards do not have any envelopes or stamps i know i do not have any
can you buy some envelopes and stamps for me dear,okay how much are stamps now
they are 41 cents each I am sorry about your package,maybe itll be there when you go back what package
nothing it is not important,it is just something fun something fun
what is it when simon gets it hell show you,okay i like getting packages and letters my
friend writes a letter to me every month,why do not you use email no way
i like finding letters in my mailbox hey betty,we are not open yet thats okay
i just have a message for simon i found your package great,where is it in alaska
what why,the sender sent it to the wrong address the post office tracked your package
honey ill call girls exercise today about your dvds,dvds girls exercise
i ordered some girls exercise dvds,they have great exercises for my back simon is embarrassed because the dvds
are for women,the exercises work for men too it is okay simon i use girls exercise too
really yes,we can exercise together sarah
how are you hows your boyfriend,betty you know i do not have a boyfriend i know
but you will someday sorry,i asked too many personal questions i do not mind
guess what i just started a blog about life in,small town great do you write about me
of course i have to write about our towns post,mistress and the editor of our town newspaper thats right
hi girls phew,my favorite salesman what are you selling today
well you know whenever i come to town i always bring something interesting,we know well today is no different
here a book,open it hey
there are no pages in this book thats right you do not read this book,you keep things in it no thanks you
someday youll buy something from me betty,maybe number four smoothly smoothly smoothly
okay smoothie is the mixture of fruits and ice cream or milk,smoothie smoothie number five milkshake milkshake milkshake is the mixture of
ice cream or milk with flavor of fruits okay and then we shake them until it is,full of bubbles milkshake milkshake
number six milk milk,number seven cocktail cork tail tale american english
long or cocktail british english,cocktail cocktail cocktail is a mixture of fruit juice
and a kind of,strong alcoholic drinks okay cocktail eight coke or cola
coke or cola do you know cocacola okay the same,color soda
soda beer,beer lemonade lemonade is just like
lemon juice okay lemonade mineral water mineral water is the,natural water mineral water hot chocolate hot chocolate people like
to drink this one in the winter because it is hard it is warm okay hot chocolate,wine wine
champagne champagne remember this is ch but we,do not pronounce like chicken okay this is
champagne champagne,we usually drink champagne for the new year
coconut water coconut water okay so one more time smoothly smooth the,milkshake milkshake
milk milk,cocktail cocktail coke
color soda,beer lemonade
lemonade mineral water mineral water,hot chocolate hot chocolate
wine wine champagne,champagne coconut water coconut water
now lets go to some questions and answers what kind of beverage beverage,the same meaning with drink okay what kind of beverage do you usually drink
what kind of beverage do you usually drink i usually drink milk i usually,drink milk do you know how to make lemonade that
means can you make lemonade do you know how to make lemonade yes,of course i do of course they do it is very easy to make it is very easy to make
of course i do it is very easy to make sorry i do not know sorry i do not know,is this the is this cocktail good is this
cocktail good yes it is link them together yesterdays,very tasty yesterday is very tasty
not really it is okay not really it is okay,text
i love the beach meku hey roger,does this beach have cute lifeguards i do not know
how do i say help I am drowning,in chinese you can just say
jo ming can you swim patty,yes but maybe i can practice chinese with a
cute lifeguard patty do you need some sunscreen daisy,i can put it on your back for you no thanks i want a tan first
why my skin is too white,roger do you want some sunscreen not yet I am going in the water first are you
girls coming lets go,that was fun i love the ocean
me too swimming is fun,i like swimming in a pool better though the water is cleaner and it does not have
salt in it well you do not have to drink the ocean water,i did not try to drink it you splashed me the water went into my mouth
I am sorry no you are not you are right,there are not very many people in the ocean today
maybe chinese people do not like to swim no you are wrong,i see chinese people at the pool all the time
some of them are great swimmers,well maybe they are not here to swim
maybe they just come to the beach to have fun,thats why we are here hey guys lets go for a walk along the
beach okay,I am going to lie here on my towel a little longer i want a tan
come on you can go with us and get a tan at the,same time all right
but first you both really need to put on some,suntan lotion that was a fun walk paddy
but the rocks on the beach hurt my feet why did not you wear sandals i told you,to and I am hot too
we walked a long time we did,but i found some pretty rocks I am glad but lets go swimming now
i want to cool down that sounds good lets go swimming again,wait take my picture first okay
patty are you coming with us,no i want to look for more pretty rocks now
