pregunta,respuesta
please call me victor sam victor let me introduce you to someone,lynn this is victor tang he has the regional rep for ocean wide this is lynn
chan my sales manager how do you do mr tang I am very well thank you nice to,meet you miss chen and you can i get you another drink thank you
well it is been good to meet you sam and very interesting to hear about your,business look we are having a small dinner for
some of our clients and friends after this,why do not you join us thats very kind of you ill just check
with my associate whether they have other arrangements for us well your,associate is most welcome to join us too thank you excuse me
walter this is sam ericks from erics imports,he has very kindly invited us to a dinner yes would you like to join us
unfortunately i have another engagement thank you for the invitation,well perhaps you could join us after that for a drink
sounds great id be happy to where shall we meet,how about the lounge bar here at about 10
ill see you then excuse me,lynn victors joining us for dinner wonderful
i hope you do not mind of course not you are most welcome,well um should we make a move would you mind if i just say goodbye to a few
people no problem,well see you outside in a few minutes okay
another drink sir no thank you,excuse me is anyone sitting here no
please have a seat thats better my feet are killing me,have you been here long no but i just flew in this morning and i
have not had a chance to sit down since then,no where have you come from
from manila is this your first visit to australia no,i have been once before but it was a long time ago
and have you been to sydney before no it is an amazing city,yes it has its points but you are lucky to live in manila it is a fascinating
city what about yourself,do you live in sydney no i live in melbourne I am just here for
the conference I am going to melbourne later,whats the weather like there not too good in winter but at the moment
it should be okay so,hows your hotel it is good very convenient
just near the harbour have you seen the opera house yet yes we,flew right over it excuse me theres someone i must talk to
it is been very nice to meet you I am walter by the way you too I am sue,perhaps well meet later i hope so
has everybody got a copy of the agenda would you mind taking minutes john,not at all good well then lets get started
first of all thank you everyone for attending at,short notice as you know the objective of this
meeting of the capital works committee is to discuss a proposal for some urgent,building work at our south side plant as we have got to reach a decision which
may involve spending well run it as a formal meeting,now you have read the proposal so without further ado id like to open
it up for discussion or perhaps if we can start with you tan,whats your view well I am not convinced that the work is
as urgent as this report suggests so to sum up i think we are all aware,that some urgent work does need to be done and we will need to work on a
longer term plan for a major refit well,if theres no more discussion well put it to a vote
we are recommending that tenders be called for the urgent work needed,all those in favor all those against
then thats agreed any other business,then well close the meeting thank you everyone the next meeting will
be in two weeks at the same time well I am not convinced that the work is,as urgent as this report suggests so perhaps come on the building is
practically falling down sorry lin i do not think tan had finished well get,to you in a minute sorry as i was saying
perhaps we should get a second opinion before we spend any money,thank you tan whats your opinion walter
well as far as I am concerned it is a question of safety so i think we should,go ahead are you suggesting that someone could
get hurt in my opinion yes if you ask me there is a serious risk of,an accident and it is not a recent problem
are you implying we should have done something earlier,much earlier it is a real concern here in that case i agree
we should do something now i think so too,thank you walter well if theres no excuse me madam
chairperson yes barbara what about the problem with parking there were no,places again this morning maybe if you got to work on time
all comments through the chair if you do not mind walter,parking is not on the agenda for this meeting
perhaps you could suggest it for our next meeting barbara,well if theres no more discussion well put it to a vote here here
okay now we are looking at the options for,handling our online orders they are going through the roof and frankly the lead
time for delivery is blowing out we need to improve our performance in,this area any suggestions
well as i said we have three options the obvious one is to employ more people,to do the job another alternative is to automate the
system more cut down on the physical handling,and the third option we could outsource
what are the pros and cons well looking at increasing staff versus,automation we have to consider the cost automating has a higher capital cost
than putting on more staff on the other hand employing more people,is more expensive over a long term if we keep growing itll cost more in
the long run how likely is it that well see,continued growth id say it is a certainty
id say a high probability nothing certain in business,so what about the third option outsourcing
it does take the problem off our hands but we lose contact with our customers,what about the bottom line outsourcing is the cheapest option and
the easiest in the short term but if we want to keep the operation in,house the best option is automating our system
the only downside is we are taking a risk that our business will keep growing,which we hope it will we certainly do today we are looking at our new widget
plant being built at south side ive asked barbara to report on progress and,bring us up to date and up to speed barbara thanks denise
ill just outline the process we have been through identify some problems and give,you an estimate on completion time and the outcome financially is it good news
or bad news bear with me,now if you recall after a feasibility study we put the
project out to 10 to 18 months ago and selected easy build as our project,manager work commenced about 15 months ago and
it is been progressing to schedule until recently,whats the problem unfortunately there are
three firstly theres been a delay in materials,specifically steel because of industrial issues at the suppliers
secondly we have lost days due to the weather,and finally theres been a resulting cost blowout
so what are we going to do well they have managed to get another,supplier now i suggested moving the completion date
back that way theres no penalty and they agreed to redeploy their workers,until building can start again smart thinking
we have been waiting for the rain to stop but we cannot control the weather,and the cost at this stage just a small overage but
ill be watching it very closely over the next few months,with no more delays we are expecting to complete the project
just one month behind schedule good work barbara,now id like to refer to the first graph as you can see this is a bar graph
measuring net sales over the first 10 months of the year,youll notice that sales rose steadily in the first few months
then there was a marked increase in april,they peaked in may at around 32 million and leveled off
then there was a dramatic drop in the following month,followed by a significant increase in august and this trend has continued up
until the present what was the reason for the sudden drop,in july this was mainly due to a dropoff in air
conditioner sales so it is a seasonal effect,could it be a consequence of the negative effect of the interest rate
rise possibly,now if i could draw your attention to this next diagram
this is a line graph of sales the blue line represents air conditioner,sales the red line shows heaters
as youll note air conditioner sales dropped steadily from january to july,bottoming out then while heater sales experienced a sharp
increase from march to june then dropped markedly from june to july,then declined through to september with a pronounced drop in october
does this explain the fluctuation in total sales largely if we look at this,pie diagram you can see that air conditioners and
heaters together represent more than half of our total sales,but they vary seasonally while other appliances are fairly steady through the
year well we cannot sell air conditioners when,it is cold whats the solution
export to europe and america easier said than done,today I am going to look at the results of our customer survey
first ill go through the survey questions,then summarise the results and finally ill outline the conclusions
after that therell be time for questions and discussion so,lets start with the survey questions turning to the results
as you can see from the diagram most people decided what to buy when,they saw the product at the showroom about onethird made their decision
based on what the salesperson said the others knew what they wanted to buy,already most of those made their decision on the
recommendation of a friend only a few said they relied on,advertising lets move on to the conclusions
the first one is that it is very important that,salespeople on the floor know about our products
another is that after sales service is critical,people who experience good after sales service are more likely to recommend a
brand and finally,advertising it is expensive so we need to make sure
we are getting results so id like to end with a summary of,what ive looked at today and some recommendations
the figures show that sales are strongly seasonal and that customers depend on,good information on the showroom floor so id like to recommend we concentrate
on discounting in the off seasons and spend more time on briefing our sales,representatives thats all i have for now
are there any questions you mentioned that the sales figures,may also reflect economic trends can you expand on that
well we are always going to depend on the economy,as i understand it we can look forward to an improvement this year
does that answer your question are you saying we are in for a period of,growth well I am afraid thats a bit outside my
area of expertise but thats what the papers are suggesting,if you believe it you suggested that we might be spending
too much on advertising can you clarify that,it is hard to quantify without better data
sorry could you repeat that,we do not have the figures to really know how effective our advertising is
in my experience you cannot do without advertising,time for one last question i have one yes john
is it time for coffee okay well wrap up now,thank you for your input everyone thank you
wilson wilson can i help you yes this is lynn chan from acme appliances id like,to speak to mr wilson if he has available please would that be mr wilson senior or
mr wilson jr mr wilson senior ill just see if he has available hold the,line please
it is a lynn chan from acme I am sorry mr wilsons in a meeting at,the moment may i take a message yes could you ask him to phone me please
my number is two three double one five six five four I am sorry,i did not catch your name lin chan acme appliances let me check
the number two three double one five six five four thats right,ill pass that message on thank you thanks bye
acme appliances lynn chan speaking this is tom wilson returning your call,ah yes mr wilson thanks for calling back i wanted to set up a meeting with you to
discuss your requirements for next year yes certainly how about uh,thursday at 2 30 that would be fine
okay i look forward to seeing you then thursday 2 30 see you then goodbye,goodbye hello lin chan sales manager for
national sugar and my associate john martin very pleased to meet you I am,victor tang and this is my legal advisor sue panet i hope you had a pleasant
flight over yes we did thanks are you staying for a few days unfortunately we,need to get back to manila tomorrow well wed better get down to business
mr tang to start off with i just want to say we believe we can offer you a very,good deal and come up with a winwin result well from our point of view we
see it as an exploratory tool testing the water you might say we do not intend,to reach any agreements at this meeting in any case we would need to run it past
our board first you have not heard our terms yet you may find them hard to,resist of course we understand you need time to
consider any offer my first priority is to keep the negotiations open,whats your proposal ms chen we are prepared to offer a very
attractive price for a minimum sale in exchange for a twoyear contract john,will clarify the terms so thats our offer we believe it is a
fair one with advantages for both sides yes well we are prepared to consider your,offer miss chant if you can accept some conditions
and subject to consideration by the board,what are the conditions well firstly the price you are proposing
would that be variable depending on currency fluctuations,the issue is that we are in an unstable environment at the moment
the exchange rate could affect us negatively,us too true
but the problem is that we are tied to the us dollar we could consider hedging,against currency in both directions that would be acceptable
another problem we may have is that of supply,our customers often need supply at short notice if we do get large orders we need
to guarantee delivery so we need the stockpile,the difficulty there is the capital outlay
how would you feel about a partial offset against our sales you mean alone,i suppose so would you be agreeable to a deferred
payment we can provide security of course,i think that would be acceptable unfortunately i would need to get board
approval for it of course,then i think we might have a deal in principle
time to celebrate our keynote speaker is a man who I am,sure is very well known to all of you he has professor of fruitology at dubbo
university and has written many books on the subject of tropical fruit,so without further ado id like to introduce our keynote speaker dr sam
erics thank you denise,the honourable judith bryant minister for trade professor eric vogel professor
of economics at wagga university distinguished guests ladies and,gentlemen todays topic why bananas are bent
is a very significant one in terms both of international trade and culture,in thinking about the topic i felt it would be appropriate to address briefly
the history of bananas and banana farming the many qualities of bananas,both positive and negative and of course examine the uses of the
banana but first,let me tell you a story about a banana ladies and gentlemen i hope ive been
able to clear up a few misconceptions and leave you with some new ideas about,how we might view bananas in the future we have seen in looking at their history
that bananas have a significant role in many cultures,ive also noted their positive nutritional qualities
and in addressing the main question why bananas are bent we have learned that the,reasons are many and complex madam chair thank you for the
opportunity to address the conference today and thank you ladies and gentlemen,for your kind attention well it has been a great pleasure to
meet you sam and lynn yes we have enjoyed meeting you too victor yes it is been,great what a pity you have to go home well all good things must come to an end
but I am sure well meet again yes i hope so,and good luck with your business I am sure it will go well
and i wish you every success too well i think we should drink a toast to,the end of the conference and to ourselves
heres to us cheers,cheers we should keep in touch
yes have i given you my card no thanks very much heres mine,do you have a card lin yes thank you
ill send you an email and if you are ever in singapore you must look me up we,certainly will and you have my number when you are next in sydney give me a
call well have a drink may i take these,well id better get going or miss my flight have a good flight home bon
voyage goodbye until next time goodbye,lets compare e and a together some of my students they find it is quite
tricky to distinguish between this cell now and now okay lets study,this is f
to make the air sound very easy uh like this your,your lips are slightly open like this and at the same time put your
jaw and your tongue down okay,some people spread their lips into both sides like this
no sorry it is not correct okay just put your jaw and your tongue down,so this is
wet wet,this one pan
pan this,lead let
some of my students they pronounce like wet or that,or what this is
open,sorry they are not correct okay put your jaw in your tongue down
very quick wet,wet pen
pen this one,let let
now one e,uh they are somehow the same because they
have the same vowel air right but this is the deep thong diphthong two,single vowels together so they come from e
and then end in e okay begin with e,and end with e
e okay now match them together,a a
okay somehow the same with a a very soft okay a,now again this one
just drawer and then,and this one a little bit open
and then close a,a understand so
a,a this is
weight weight,this one pain
pain this is a,a and then aint so we have pain
pain this one,late late
now compare them together wet,wet weight
weight pain,pain pain
pain let,let light
light okay uh can you hear the differences between,them yes right now one more time quicker
wet wet,wait wait
wait wait,pen pen
pain pain,pain pain
let let,light light
let light now lets come to,e and air somehow the same too right
now just move your tongue in your jaw down,this one come from
remember air,again huh this is stop here
and this one quicker air air,so again e
air air can you see the difference,yes right now
we have very,very fairy
fairy fa,air air
shared shared,very very
fairy fairy,text
where did you say it was this is it barca street we are looking,for number 57 what am i going to say to him itll be
fine he has your brother so he has going to knock,i guess i will I am so nervous do not worry well be here
hello hello i wonder uh,I am sorry to bother you I am looking for it is very hard to explain
perhaps my partner can help you david,it is so good to see you
I am so ashamed ive been so selfish,I am so glad you are all right ive been so worried
rose this is my sister ann your sister,and this is my girlfriend rose you better come in david has not told me
very much about his family I am so sorry,and i feel very bad about not contacting you i just cannot believe it i was
looking for you thinking that something terrible must have happened and here you,are playing house theres someone you should meet
this is our son sam sam,meet you aunt anne david
my little brother and father he has beautiful,david why do not you tell me about rose why did not you tell me you were a father
i think id like to know that too i would have come and helped you,it is hard to explain i have some friends outside who helped
me find you i think you need to tell us all what,happened ill go and get them I am an aunt
sarah steve this is my brother david and his partner,rose and this is my nephew sam
he has good i know you uh you,shop at your stool yeah green apples he always wants green
onions thats right good memory david,i think youd better all sit down
what happened why did you stop writing i started my course at university but,it was very difficult computer science is not for me
did you fail your exams yes,i let everyone down i just wanted to die
dad must be so angry he has just worried about you david i did not know what to do,i was so confused i had to find a job i couldnt use
fathers money anymore so,i applied for a job at the markets and phil was very kind he agreed to give me
a job if i could get a working visa how did you,i went home and applied for it you mean you went back to singapore
yes i was too ashamed to see anyone,I am such a failure i do not think you are a failure
anyway i returned here and,i started work i met rose
and we moved in together and well then sam came along,it is an amazing story i think it is wonderful
mum and dad will not think it is that wonderful,theyll be so relieved you are safe we did not know what to think david
cannot i just disappear you can pretend i do not exist no you should have told me i,could have helped why did not you realize wed come and
look for you i just couldnt face dad,you could have told your sister i ought to have told you anne
i should have trusted you I am so sorry,he has so beautiful david you cannot keep him from mum and dad
they are flesh and blood david they are sams grandparents,do not you think they want to see him so you think i want to meet your parents
rosies right david mum and dad so much want to be grandparents,but not like this your secrets out now
steve it is all right sarah steves right and i think david knows what he has to,do do you suggest hello mom it is me david
yeah I am okay I am all right yep,ann found me yeah yeah I am working um
look I am so sorry that i did not call you,can you forgive me yeah
okay all right i love you too,yeah all right
moms crying she has gone to get dad,he has gonna be so angry hello dad
it is me david do you realize how ready we have been,yes i am you are our son how could you do this to us I am sorry for causing you so
much worry dad i thought that youd be angry,thats why i did not tell you i couldnt study anymore of course I am angry your
mothers been sick with worry but you did not have to disappear what ive been,doing all this time ive been working i work at the market
I am gonna be a partner in the business soon,and dad theres something else I am with someone
and we have a baby boy dad,dad are you still there did you say you were married
not exactly i have a partner,her name is rose and we have a son
your grandson dad,I am here david theres too much to think about i want you to come home but i know
but you need to come home,bring her bring rose and our grandson
your mother and i love you we want to see you,we are going to meet your family goodbye ill see you soon
yeah i promise i love you too,well what did they say my mother said she was glad that I am okay
she said she was happy to hear my voice she told me that she has been very worried,what about dad what did he say he said he was very angry
but that he forgives me he told me that he loves me,of course he loves you he has your father did he say anything else
yes he asked me to go home,he said they want to see us all of us yes they want to meet you
and sam they asked us to go to singapore,we cannot afford it he has sending us tickets
of course he is he loves you david we all do,and now theres rose and sam too id love to meet your parents david and sam
wants to meet his grandparents they are our family,look I am so sorry it is okay
it is all out now well go as soon as possible,you can come with me what about me can i come too
you are not family steve well,you found your brother you have ordered your wine and tomorrow you are going home
yes sarah thank you for everything,but youll come back will not you yes if the wine says well ill be back
soon i feel as if i have a second family here,id love to come and see you in singapore yes ill show you around
and you must meet my parents thatd be great if our business goes well ill be,able to afford it theres no ifs about it
you are a very good agent I am so happy you are my buyer here,if you like ill come to singapore with sarah
i like that very much you can meet my parents too,do you think theyll like me of course ill like you
if i like you theyll like you i think i better leave you two alone,bring me if you need help with packing ive only just met you and now you are
leaving but ill come back,if you want me to well i guess this is it
sarah thank you so much for all your help and for your kindness please do not,mention it well thank you for trusting me to be
your business partner and my friend ill be thinking of you all the time,i wanted to thank you too sarah for being so kind to my sister and looking
after her so well ill be thinking of you too thank you,it was great to meet you new too rose
and i hope everything goes well in singapore I am looking forward to meeting,davids parents i hope they like me I am sure they will
ill be expecting a postcard from you anne,so you better send me one and ill be waiting for a postcard too
ill be counting the days until you come to singapore attention please this is,the final call for singapore airlines flight sq452 direct to singapore could
all passengers for this flight immediately,goodbye see you soon goodbye ill see you soon
goodbye rose good luck you too david bye,see ya bye wait i found him
i found a brother another one,from number one to number five
these colors are not easy to pronounce so pay attention to these because they,have the consonant clusters b l b r and gr consonant cluster that
means one sorry that means two or three,consonants together this is b l b r and g r
first one lag,black do not say black or black okay this is black
black this one,blue blue
this one brown,brown this one gray
gray a y or e y the same okay,uh a
and y this is british sorry this is american english and e well this is,british english okay so great this one green
girl green green,so again black black
blue blue,brown brown
gray gray,green green
this one pink,pink purple er
purple this one,arranged remember orange
orange red,red yellow
yellow white,white one more time
black black,blue blue
brown brown,gray gray
green green,pink pink
purple purple,orange orange
red red,yellow yellow
white white,for the appetizers appetizers okay appetizers
i have vegetable do not say,table or veg table okay that vegetable soup
chicken soup chicken soup now house salad house salad,for the main dishes we have steak with fries
steak with fries this one beef stir fry beef,stirfry um now
